,comment_id,comment_parent_id,comment_body,comment_permalink,comment_author
118,hizax24,t1_hiymmo0,Ultimately people would do this when they realise they can make a living out of it. May be Collanote founder might promise its free for now but yeah when the money rolls in people change.,/r/GoodNotes/comments/qkkp95/after_notabilitys_anouncement/hizax24/,willnessNo2365
119,hizb037,t1_hixmds9,"u/crysis4000 can you share the link for your reference, I want read those guidelines.",/r/GoodNotes/comments/qkkp95/after_notabilitys_anouncement/hizb037/,willnessNo2365
120,hj0tlaf,t1_hixmds9,Didn’t Fantastical do the same? They still seem to be doing the freemium model,/r/GoodNotes/comments/qkkp95/after_notabilitys_anouncement/hj0tlaf/,Odd-Imagination-720p
121,hixgfd8,t1_hixfhw8,"Damn, what a drag. I usually use more notability (for reading mostly) but still. I've been looking at it and apparently it violates Apple's policies, I hope people is right. And yes, I use both notability and Good notes.",/r/GoodNotes/comments/qkkp95/after_notabilitys_anouncement/hixgfd8/,yonosoymajo
122,hizbmmo,t1_hiz234h,The consequences of Notability event is that I'll be reluctant to pay any app even it deserves the money at present.,/r/GoodNotes/comments/qkkp95/after_notabilitys_anouncement/hizbmmo/,jostyee
123,hizijym,t1_hizb037,"Apple’s guidelines, 3.1.2(a):
If you are changing your existing app to a subscription-based business model, you should not take away the primary functionality existing users have already paid for. For example, let customers who have already purchased a “full game unlock” continue to access the full game after you introduce a subscription model for new customers.",/r/GoodNotes/comments/qkkp95/after_notabilitys_anouncement/hizijym/,optimists_unite
124,hj12ntc,t1_hj0tlaf,"Fantastical didn't remove any features from existing users. Of course, they still made their experience worse by littering the app with ads.",/r/GoodNotes/comments/qkkp95/after_notabilitys_anouncement/hj12ntc/,Ethesen
125,hiziudf,t1_hizijym,Ah Cool thanks...,/r/GoodNotes/comments/qkkp95/after_notabilitys_anouncement/hiziudf/,willnessNo2365
126,hj39ye4,t1_hj12ntc,Oh I see,/r/GoodNotes/comments/qkkp95/after_notabilitys_anouncement/hj39ye4/,Odd-Imagination-720p
127,gx4gv2t,t3_n5yb7z,"Please tell me how did you make such clean diagrams??
And how do you have such a clean writing???? I've been using it for a month and my writing is so clumsy!
Absolutely love this",/r/GoodNotes/comments/n5yb7z/my_first_time_doing_digital_notes/gx4gv2t/,knowellDome
128,gx5gb6t,t3_n5yb7z,"Me thinking my notes look good for once

The girl sitting next to me:",/r/GoodNotes/comments/n5yb7z/my_first_time_doing_digital_notes/gx5gb6t/,FindusDE
129,gx5griy,t3_n5yb7z,"That's a font, right? Don't tell me it's your handwriting. Don't fucking tell me it's your handwriting...oh god 😭😭😭😭😭😭😭😭",/r/GoodNotes/comments/n5yb7z/my_first_time_doing_digital_notes/gx5griy/,saujanya5
130,gx4k497,t3_n5yb7z,"Wow thats so satisfying! Do you write on full screen or you zoom to areas? I would love to have that calligraphy, mine literally sucks 😂",/r/GoodNotes/comments/n5yb7z/my_first_time_doing_digital_notes/gx4k497/,Frostres
131,gx49rhd,t3_n5yb7z,Your drawings are so good,/r/GoodNotes/comments/n5yb7z/my_first_time_doing_digital_notes/gx49rhd/,robinharris98
132,gx4fbfn,t3_n5yb7z,gorgeous,/r/GoodNotes/comments/n5yb7z/my_first_time_doing_digital_notes/gx4fbfn/,nessathebee
133,gx4geyp,t3_n5yb7z,"What isn’t good? I’m mindblown by your drawings, writing and presentation. Great work mate!",/r/GoodNotes/comments/n5yb7z/my_first_time_doing_digital_notes/gx4geyp/,nlpat016
134,gx4jpjv,t3_n5yb7z,Such amazing notes! Are those body parts handdrawn or are they pictures?,/r/GoodNotes/comments/n5yb7z/my_first_time_doing_digital_notes/gx4jpjv/,Duinaart
135,gx4kqq5,t3_n5yb7z,i love it!!,/r/GoodNotes/comments/n5yb7z/my_first_time_doing_digital_notes/gx4kqq5/,shrekfrom1994
136,gx4lyzp,t3_n5yb7z,"Really cool, love your handwriting!",/r/GoodNotes/comments/n5yb7z/my_first_time_doing_digital_notes/gx4lyzp/,indigatuna
137,gx4o4aj,t3_n5yb7z,11” or 12.9”?,/r/GoodNotes/comments/n5yb7z/my_first_time_doing_digital_notes/gx4o4aj/,YourDailyConsumer
138,gx5mpk5,t3_n5yb7z,I’m obsessed!,/r/GoodNotes/comments/n5yb7z/my_first_time_doing_digital_notes/gx5mpk5/,pancakesforfun
139,gx5xqiy,t3_n5yb7z,I love your diagrams! Damn I wish I could draw like that,/r/GoodNotes/comments/n5yb7z/my_first_time_doing_digital_notes/gx5xqiy/,Lyn013
140,gx6kt4p,t3_n5yb7z,[deleted],/r/GoodNotes/comments/n5yb7z/my_first_time_doing_digital_notes/gx6kt4p/,
141,gxi2oba,t3_n5yb7z,It looks amazing!,/r/GoodNotes/comments/n5yb7z/my_first_time_doing_digital_notes/gxi2oba/,Ender-Wang
142,hddlqz2,t3_n5yb7z,Dam amazing penmanship.,/r/GoodNotes/comments/n5yb7z/my_first_time_doing_digital_notes/hddlqz2/,808lilangel
143,i1pgcch,t3_n5yb7z,Literally note porn 🤤,/r/GoodNotes/comments/n5yb7z/my_first_time_doing_digital_notes/i1pgcch/,maryjanedahmer
144,i7bbyt4,t3_n5yb7z,I like the paper.... will use next time.,/r/GoodNotes/comments/n5yb7z/my_first_time_doing_digital_notes/i7bbyt4/,SereNere
145,io3cvcs,t3_n5yb7z,This person is a genius,/r/GoodNotes/comments/n5yb7z/my_first_time_doing_digital_notes/io3cvcs/,HACKDABLAQ
146,gx58yee,t3_n5yb7z,Have fun doing theses for every bone and muscle... such a waste of time.,/r/GoodNotes/comments/n5yb7z/my_first_time_doing_digital_notes/gx58yee/,lukas_napster
147,gx4zq8v,t1_gx4gv2t,"Thank you!! :) I'm an artist! I do most of my work digitally, so drawing the diagrams was no different other than not having many pens/brushes to work with :) And writing on here was hard, I have a lot more consistency with traditional pen and paper. As cliche as it is, practice will make perfect! :)",/r/GoodNotes/comments/n5yb7z/my_first_time_doing_digital_notes/gx4zq8v/,Residentofvault101
148,gx5h67v,t1_gx5griy,It is indeed my handwriting! :) Lololol,/r/GoodNotes/comments/n5yb7z/my_first_time_doing_digital_notes/gx5h67v/,Residentofvault101
149,gx4kq6u,t1_gx4k497,"Same!
I can never make my handwriting look so uniform. It's normal in one line, italics in the next lol",/r/GoodNotes/comments/n5yb7z/my_first_time_doing_digital_notes/gx4kq6u/,knowellDome
150,gx4zbaq,t1_gx4k497,"Thank you!! I tried zooming in but hated it, I had no consistency. I wrote full screen :)",/r/GoodNotes/comments/n5yb7z/my_first_time_doing_digital_notes/gx4zbaq/,Residentofvault101
151,gx4zros,t1_gx4geyp,Aww thank you so much!!! :),/r/GoodNotes/comments/n5yb7z/my_first_time_doing_digital_notes/gx4zros/,Residentofvault101
152,gx4zepy,t1_gx4jpjv,Thank you so much! And they're all hand drawn :),/r/GoodNotes/comments/n5yb7z/my_first_time_doing_digital_notes/gx4zepy/,Residentofvault101
153,gx4z8fx,t1_gx4o4aj,12.9 :),/r/GoodNotes/comments/n5yb7z/my_first_time_doing_digital_notes/gx4z8fx/,Residentofvault101
154,gx6sdfn,t1_gx6kt4p,Getting used to this was super hard so it took about two hours :),/r/GoodNotes/comments/n5yb7z/my_first_time_doing_digital_notes/gx6sdfn/,Residentofvault101
155,gx59wko,t1_gx58yee,"Lol sincerest apologies, didn't realize that how I spend my time somehow impacts you. I will have fun, thank you :)",/r/GoodNotes/comments/n5yb7z/my_first_time_doing_digital_notes/gx59wko/,Residentofvault101
156,gx5005o,t1_gx4zq8v,"Ah i see.
Nice work. I wish to someday be able to take notes as clearly as you do",/r/GoodNotes/comments/n5yb7z/my_first_time_doing_digital_notes/gx5005o/,knowellDome
157,h21p1kd,t1_gx4zq8v,The way you cross your t’s is kinda cute,/r/GoodNotes/comments/n5yb7z/my_first_time_doing_digital_notes/h21p1kd/,shitpouch
158,gxsjksv,t1_gx4kq6u,In my case I think it's worse: it's normal and italics in every word.,/r/GoodNotes/comments/n5yb7z/my_first_time_doing_digital_notes/gxsjksv/,Denis_red
159,h21p7jj,t1_h21p1kd,Haha thank you! My f's are the same way but the line points the other way 🤣,/r/GoodNotes/comments/n5yb7z/my_first_time_doing_digital_notes/h21p7jj/,Residentofvault101
160,gxsjskj,t1_gxsjksv,"Haha
I totally get you!",/r/GoodNotes/comments/n5yb7z/my_first_time_doing_digital_notes/gxsjskj/,knowellDome
161,gi5avch,t3_kqqa3p,"Hopefully I did this right but [click here ](https://drive.google.com/drive/folders/1_uNit3aGcFWLaqwgeDNbVg866Y9g_mq4) for the google drive link 

All are size A4 

Also wanted to give a shout-out to free stock images site raw pixel where I got many of the images 

Hope you enjoy!

Edit: in order to make same size as a4 paper you need to convert jpeg to a PDF

Edit 2: I impulsively made an Etsy shop as well for some more of my designs, if anyone is interested in checking them out [Goodnotes Girl Etsy shop ](https://etsy.me/3cUY1KE)",/r/GoodNotes/comments/kqqa3p/i_tried_out_procreate_and_made_25_fun_notebook/gi5avch/,hippiesinthewind
162,gi5fy40,t3_kqqa3p,"thank you, i love you",/r/GoodNotes/comments/kqqa3p/i_tried_out_procreate_and_made_25_fun_notebook/gi5fy40/,marieeejaneee
163,gi5qzok,t3_kqqa3p,"Beautiful, thank you kind soul.",/r/GoodNotes/comments/kqqa3p/i_tried_out_procreate_and_made_25_fun_notebook/gi5qzok/,berniceeboo
164,gi60aq3,t3_kqqa3p,"does someone know if there is a way to add custom templates (not as documents but for example in the ""covers"" section when creating a new document.",/r/GoodNotes/comments/kqqa3p/i_tried_out_procreate_and_made_25_fun_notebook/gi60aq3/,This_Is_Marin
165,gm0yqty,t3_kqqa3p,"Shared this to a digital stationery community in Discord. Thank you so much. 

https://discord.gg/x898kcQ",/r/GoodNotes/comments/kqqa3p/i_tried_out_procreate_and_made_25_fun_notebook/gm0yqty/,slothfarmies
166,gi5d8c1,t3_kqqa3p,Thank you !,/r/GoodNotes/comments/kqqa3p/i_tried_out_procreate_and_made_25_fun_notebook/gi5d8c1/,moxomonkey
167,gi5k77l,t3_kqqa3p,"Thank you so much, my semester started yesterday and this is what I was looking for",/r/GoodNotes/comments/kqqa3p/i_tried_out_procreate_and_made_25_fun_notebook/gi5k77l/,prateekgandhi718
168,h1bc3rm,t3_kqqa3p,"I know this is old, but I just downloaded and am using as my covers on Procreate. Thanks again for the share!",/r/GoodNotes/comments/kqqa3p/i_tried_out_procreate_and_made_25_fun_notebook/h1bc3rm/,MaryLane123
169,hl7am4s,t3_kqqa3p,thank you these are so pretty!!,/r/GoodNotes/comments/kqqa3p/i_tried_out_procreate_and_made_25_fun_notebook/hl7am4s/,Apart_Barracuda9553
170,iwhxokw,t3_kqqa3p,Gracias,/r/GoodNotes/comments/kqqa3p/i_tried_out_procreate_and_made_25_fun_notebook/iwhxokw/,Budget-Recording-569
171,iwp8oo6,t3_kqqa3p,I hope it's not too late to say thank you. Regards!,/r/GoodNotes/comments/kqqa3p/i_tried_out_procreate_and_made_25_fun_notebook/iwp8oo6/,deathisinevitableshh
172,gi5hmbi,t3_kqqa3p,Thank you,/r/GoodNotes/comments/kqqa3p/i_tried_out_procreate_and_made_25_fun_notebook/gi5hmbi/,TrinElle1979
173,gi68t9k,t3_kqqa3p,"it's great, thank you!",/r/GoodNotes/comments/kqqa3p/i_tried_out_procreate_and_made_25_fun_notebook/gi68t9k/,ginzaglitzerglitzer
174,gi6m6jd,t3_kqqa3p,Very cool! 👍🏽👍🏽👍🏽,/r/GoodNotes/comments/kqqa3p/i_tried_out_procreate_and_made_25_fun_notebook/gi6m6jd/,SynSthSea
175,gi6w113,t3_kqqa3p,"Amazing, thanks so much!",/r/GoodNotes/comments/kqqa3p/i_tried_out_procreate_and_made_25_fun_notebook/gi6w113/,Constant-Juggernaut2
176,gi7fh7x,t3_kqqa3p,Thank you!! These are so beautiful!,/r/GoodNotes/comments/kqqa3p/i_tried_out_procreate_and_made_25_fun_notebook/gi7fh7x/,lucychen113
177,gi7j35c,t3_kqqa3p,Thank you!,/r/GoodNotes/comments/kqqa3p/i_tried_out_procreate_and_made_25_fun_notebook/gi7j35c/,Cursepurgeplus1980
178,gi7k7yt,t3_kqqa3p,These are beautiful!,/r/GoodNotes/comments/kqqa3p/i_tried_out_procreate_and_made_25_fun_notebook/gi7k7yt/,tboykin9
179,gi7z2wq,t3_kqqa3p,These are great! The brain one is perfect for my anatomy class!,/r/GoodNotes/comments/kqqa3p/i_tried_out_procreate_and_made_25_fun_notebook/gi7z2wq/,
180,gi8aum3,t3_kqqa3p,Thank you!,/r/GoodNotes/comments/kqqa3p/i_tried_out_procreate_and_made_25_fun_notebook/gi8aum3/,LifeWithValerieRose
181,gi8r75y,t3_kqqa3p,Thank you!,/r/GoodNotes/comments/kqqa3p/i_tried_out_procreate_and_made_25_fun_notebook/gi8r75y/,TheReadyRedditor
182,gi93kik,t3_kqqa3p,Ah! Awesome! Thank you for sharing your hard work with us!,/r/GoodNotes/comments/kqqa3p/i_tried_out_procreate_and_made_25_fun_notebook/gi93kik/,AuderPop
183,gn5w26t,t3_kqqa3p,Thank you so much!🥰,/r/GoodNotes/comments/kqqa3p/i_tried_out_procreate_and_made_25_fun_notebook/gn5w26t/,ADMITITEVE-
184,gixqcc6,t3_kqqa3p,These are amazing! I would love something like this for in landscape? Does anyone have any links to any posts on reddit or other websites with adorable templates like these in landscape mode?,/r/GoodNotes/comments/kqqa3p/i_tried_out_procreate_and_made_25_fun_notebook/gixqcc6/,PearlsofWisdom93
185,glfd9yu,t3_kqqa3p,Amazing thank you so much,/r/GoodNotes/comments/kqqa3p/i_tried_out_procreate_and_made_25_fun_notebook/glfd9yu/,cicona12
186,gml9xwt,t3_kqqa3p,Thankyou so much.,/r/GoodNotes/comments/kqqa3p/i_tried_out_procreate_and_made_25_fun_notebook/gml9xwt/,BookWormAttorney
187,huax0tu,t3_kqqa3p,ooooo these are so good! The celestial one is EXACTLY what I was looking for to use for my tarot notebook!,/r/GoodNotes/comments/kqqa3p/i_tried_out_procreate_and_made_25_fun_notebook/huax0tu/,Red_Moon_Child
188,hn2hpei,t3_kqqa3p,Aaaaaa Thank you so much!!! Do you know where I can find more of these for free? Idk what key words to type in for google because so far I only seemed to find this post D:,/r/GoodNotes/comments/kqqa3p/i_tried_out_procreate_and_made_25_fun_notebook/hn2hpei/,
189,gi5vcst,t1_gi5avch,Thank youuuuu,/r/GoodNotes/comments/kqqa3p/i_tried_out_procreate_and_made_25_fun_notebook/gi5vcst/,Agnes_Nutter-
190,giucqh1,t1_gi5avch,How do I use them or make them show up when selecting a cover? I downloaded them and the document of all the covers appear but not when choosing a cover?,/r/GoodNotes/comments/kqqa3p/i_tried_out_procreate_and_made_25_fun_notebook/giucqh1/,elfamoso_art
191,gi5rax2,t1_gi5fy40,You’re welcome 😊,/r/GoodNotes/comments/kqqa3p/i_tried_out_procreate_and_made_25_fun_notebook/gi5rax2/,hippiesinthewind
192,gi5r8fi,t1_gi5qzok,"Your welcome, I was kinda bored out of my mind over the holidays, it was a fun hobby",/r/GoodNotes/comments/kqqa3p/i_tried_out_procreate_and_made_25_fun_notebook/gi5r8fi/,hippiesinthewind
193,gi6ykxt,t1_gi60aq3,Maybe? Not sure... I just put “no cover” then Goodnotes uses page 1 as the “cover” - so I can use whatever doc/image I want by importing it to be page 1 or copy/pasting to be page 1 - hope that helps!,/r/GoodNotes/comments/kqqa3p/i_tried_out_procreate_and_made_25_fun_notebook/gi6ykxt/,supcoffeeplease
194,gi5r97g,t1_gi5k77l,You’re welcome glad I could help!,/r/GoodNotes/comments/kqqa3p/i_tried_out_procreate_and_made_25_fun_notebook/gi5r97g/,hippiesinthewind
195,hl7ox42,t1_hl7am4s,You’re welcome :),/r/GoodNotes/comments/kqqa3p/i_tried_out_procreate_and_made_25_fun_notebook/hl7ox42/,hippiesinthewind
196,gi90q21,t1_gi7z2wq,"Yay! That was my intention when I made it, I showed it to my mom and she thought it was weird lol.",/r/GoodNotes/comments/kqqa3p/i_tried_out_procreate_and_made_25_fun_notebook/gi90q21/,hippiesinthewind
197,huhinz0,t1_huax0tu,Thank you!,/r/GoodNotes/comments/kqqa3p/i_tried_out_procreate_and_made_25_fun_notebook/huhinz0/,hippiesinthewind
198,giuxzxd,t1_giucqh1,"You need to import to goodnotes 

Go to settings in goodnotes and then click on notebook templates to import",/r/GoodNotes/comments/kqqa3p/i_tried_out_procreate_and_made_25_fun_notebook/giuxzxd/,hippiesinthewind
199,gi91iq7,t1_gi90q21,Moms are funny like that! I loved it and saved it! Thank you so much!! Keep creating! These are really awesome!,/r/GoodNotes/comments/kqqa3p/i_tried_out_procreate_and_made_25_fun_notebook/gi91iq7/,
200,ginxnm5,t1_gi90q21,"I love the designs they’re so pretty! But im having trouble with the sizing, maybe i imported it wrong but your covers are coming up as smaller than A4 in my notebooks :( 

Any advice on how i can fix it?",/r/GoodNotes/comments/kqqa3p/i_tried_out_procreate_and_made_25_fun_notebook/ginxnm5/,fj-3
201,givvi9f,t1_giuxzxd,Gratzi,/r/GoodNotes/comments/kqqa3p/i_tried_out_procreate_and_made_25_fun_notebook/givvi9f/,elfamoso_art
202,giqit7c,t1_ginxnm5,"Hi so I figured it out

Basically I should have save them as a PDF instead of a jpeg as I guess jpeg does save the size properly

What appears to work is turn the saved jpeg file into a PDF. I did this two different ways

1. I pressed and held on the image of notebook in my file folder leading to an array of options popping up. The last option being create PDF.

Then I uploaded pdf copy to good notes, 

While this worked I did find I had white lines on the side of the notebook but the notebook was the same size as paper

Option 2 I did was I imported the jpeg image into procreate then re-saved as a PDF, this way I did not get the white lines when importing to goodnotes

I saw some people also recommended using pages to convert to PDF.


But if you still have the white lines come up on notebook and do not want, let me know which notebook covers you wanted to use and I can do it in procreate for you",/r/GoodNotes/comments/kqqa3p/i_tried_out_procreate_and_made_25_fun_notebook/giqit7c/,hippiesinthewind
203,giowvc7,t1_ginxnm5,"I’m not sure how to fix it, I noticed that as well. all I can say is that when I chose a paper size in procreate to make them I chose A4. 

Possibly goodnotes and procreate have different size dimensions for what the consider a4? I’m really not sure

I’ll try and fool around with it today to see if I can figure something out",/r/GoodNotes/comments/kqqa3p/i_tried_out_procreate_and_made_25_fun_notebook/giowvc7/,hippiesinthewind
204,gir0ntc,t1_giqit7c,"Yayy it worked I tried converting a few to PDFs and the size is fine, there weren’t any white lines either! Thanks sm for the help :)",/r/GoodNotes/comments/kqqa3p/i_tried_out_procreate_and_made_25_fun_notebook/gir0ntc/,fj-3
205,girf655,t1_gir0ntc,Awesome!,/r/GoodNotes/comments/kqqa3p/i_tried_out_procreate_and_made_25_fun_notebook/girf655/,hippiesinthewind
206,gkpsifb,t3_l4q7si,"https://drive.google.com/file/d/1VaxP2WwYMPaIF_ppQdvx8_Q4gLl9eF8t/view?usp=drivesdk here is the link

(I know, there arent really a lot of emotions or moods drawn here, just basic and random ones)",/r/GoodNotes/comments/l4q7si/for_the_digital_journaling_folks_out_there_i_made/gkpsifb/,larisss000
207,gkq6hun,t3_l4q7si,I love this subreddit so much omg thank you!,/r/GoodNotes/comments/l4q7si/for_the_digital_journaling_folks_out_there_i_made/gkq6hun/,RL2397
208,gks957o,t3_l4q7si,Can I ask how you guys use these?,/r/GoodNotes/comments/l4q7si/for_the_digital_journaling_folks_out_there_i_made/gks957o/,Aya_Baur
209,gkq86tl,t3_l4q7si,yess I tried making something exactly like this but it did not turn out even half as good as this. hahaha thank you,/r/GoodNotes/comments/l4q7si/for_the_digital_journaling_folks_out_there_i_made/gkq86tl/,nerdyemily
210,i8wvspo,t3_l4q7si,These are amazing! Thank you!,/r/GoodNotes/comments/l4q7si/for_the_digital_journaling_folks_out_there_i_made/i8wvspo/,Ember2Fire
211,gkpvhkg,t3_l4q7si,This is adorable! Thank you,/r/GoodNotes/comments/l4q7si/for_the_digital_journaling_folks_out_there_i_made/gkpvhkg/,LurvePotato
212,gkq8h1s,t3_l4q7si,Thank you!,/r/GoodNotes/comments/l4q7si/for_the_digital_journaling_folks_out_there_i_made/gkq8h1s/,Lvargo
213,gkr9e44,t3_l4q7si,I love this so much!!!!!,/r/GoodNotes/comments/l4q7si/for_the_digital_journaling_folks_out_there_i_made/gkr9e44/,Temporaryaccount64
214,gkrbios,t3_l4q7si,Thank you! I love them!,/r/GoodNotes/comments/l4q7si/for_the_digital_journaling_folks_out_there_i_made/gkrbios/,Smiley1018
215,gktjk0k,t3_l4q7si,"Those are so cute, Thank you so much!",/r/GoodNotes/comments/l4q7si/for_the_digital_journaling_folks_out_there_i_made/gktjk0k/,Kyhar
216,gktr0ak,t3_l4q7si,"My wife wishes I could record my emotions to that degree. There are so many, I think I only need 3; happy, sad, indifferent.

Great icons Emojis btw. Really nicely done",/r/GoodNotes/comments/l4q7si/for_the_digital_journaling_folks_out_there_i_made/gktr0ak/,chwcarver
217,gl3iutl,t3_l4q7si,I love it!  thank you for sharing!!,/r/GoodNotes/comments/l4q7si/for_the_digital_journaling_folks_out_there_i_made/gl3iutl/,mercy-melpomene
218,gnz1aez,t1_gkpsifb,"These are super cute and i love the colors, thank you!!",/r/GoodNotes/comments/l4q7si/for_the_digital_journaling_folks_out_there_i_made/gnz1aez/,yamazaks
219,gkqgedx,t1_gkq6hun,You re welcome <3,/r/GoodNotes/comments/l4q7si/for_the_digital_journaling_folks_out_there_i_made/gkqgedx/,larisss000
220,gksxfiv,t1_gks957o,"Well, I usually save the images in my gallery (i always look for the ones that are .png so the background will be transparent) and then i insert that image from my gallery to goodnotes, on the page i want them to be. You can crop them in the app so you ll have just the part that you want from the stickers",/r/GoodNotes/comments/l4q7si/for_the_digital_journaling_folks_out_there_i_made/gksxfiv/,larisss000
221,gkqggaq,t1_gkq86tl,I used some pinterest images as reference haha. Thank you a lot❤️,/r/GoodNotes/comments/l4q7si/for_the_digital_journaling_folks_out_there_i_made/gkqggaq/,larisss000
222,gkpvkk0,t1_gkpvhkg,Glad you like them <3,/r/GoodNotes/comments/l4q7si/for_the_digital_journaling_folks_out_there_i_made/gkpvkk0/,larisss000
223,gkqgj68,t1_gkq8h1s,You’re welcome <3,/r/GoodNotes/comments/l4q7si/for_the_digital_journaling_folks_out_there_i_made/gkqgj68/,larisss000
224,gksx7pd,t1_gkr9e44,I m so happy you like them <3,/r/GoodNotes/comments/l4q7si/for_the_digital_journaling_folks_out_there_i_made/gksx7pd/,larisss000
225,gksx8z1,t1_gkrbios,Glad you liked them <3,/r/GoodNotes/comments/l4q7si/for_the_digital_journaling_folks_out_there_i_made/gksx8z1/,larisss000
226,gkx6tck,t1_gktr0ak,Haha thank youuu <3,/r/GoodNotes/comments/l4q7si/for_the_digital_journaling_folks_out_there_i_made/gkx6tck/,larisss000
227,gkqqmoo,t1_gkqgedx,How did you make those circles?,/r/GoodNotes/comments/l4q7si/for_the_digital_journaling_folks_out_there_i_made/gkqqmoo/,RL2397
228,gkqs3k6,t1_gkqqmoo,"In procreate, if you draw a circle and then hold it down, it will be a perfect circle. After that I just dragged the color from the top right and dropped it in the center of the circle. After I drew the first line, I just copied and pasted until I filled the whole page",/r/GoodNotes/comments/l4q7si/for_the_digital_journaling_folks_out_there_i_made/gkqs3k6/,larisss000
229,gkqt8ic,t1_gkqs3k6,The more I see these cute stickers the more I convince myself to get procreate but I’d literally only use it for random stickers,/r/GoodNotes/comments/l4q7si/for_the_digital_journaling_folks_out_there_i_made/gkqt8ic/,RL2397
230,gkr0cz5,t1_gkqt8ic,Saame haha. I only got it because my sister wanted it too so we split the price. I use it mostly for random stickers or doodles rarely when I have time,/r/GoodNotes/comments/l4q7si/for_the_digital_journaling_folks_out_there_i_made/gkr0cz5/,larisss000
231,gihph6o,t3_ksradc,such pretty notes!! do you mind sharing your cornell template? i can’t find any as nice as that!,/r/GoodNotes/comments/ksradc/became_a_fan_of_cornell_notes_in_nursing_school/gihph6o/,zoat99
232,gii7dle,t3_ksradc,Oh I was about to say I love your handwriting when I realized I follow you on YouTube! Love the studying tips :),/r/GoodNotes/comments/ksradc/became_a_fan_of_cornell_notes_in_nursing_school/gii7dle/,Colorizedd
233,giifts4,t3_ksradc,Damn how do i sell my soul to get such handwriting,/r/GoodNotes/comments/ksradc/became_a_fan_of_cornell_notes_in_nursing_school/giifts4/,Keepsilence7
234,gihtwsn,t3_ksradc,Nice! Can you share what pen type and size point you use?,/r/GoodNotes/comments/ksradc/became_a_fan_of_cornell_notes_in_nursing_school/gihtwsn/,FieldThen3413
235,gihq6we,t3_ksradc,Great example!  I couldn’t quite wrap my head around Cornell notes...,/r/GoodNotes/comments/ksradc/became_a_fan_of_cornell_notes_in_nursing_school/gihq6we/,supcoffeeplease
236,gk3ophd,t3_ksradc,How do you have tabs in ur notebook??? Also so neat and organized .,/r/GoodNotes/comments/ksradc/became_a_fan_of_cornell_notes_in_nursing_school/gk3ophd/,britneythefish
237,gij5b7g,t3_ksradc,Love Cornell notes. So easy to convert via copy and paste to flash cards too now.,/r/GoodNotes/comments/ksradc/became_a_fan_of_cornell_notes_in_nursing_school/gij5b7g/,Listeria_hysteria
238,gil1sjo,t3_ksradc,Omg I’m in the same Reddit as Janice!!,/r/GoodNotes/comments/ksradc/became_a_fan_of_cornell_notes_in_nursing_school/gil1sjo/,gracepancakes
239,gii93hq,t3_ksradc,Your handwriting is soo pretty!,/r/GoodNotes/comments/ksradc/became_a_fan_of_cornell_notes_in_nursing_school/gii93hq/,heeheenata
240,giig5ct,t3_ksradc,Your handwriting is so beautiful! I think I’m going to need to try Cornell notes! I just started sonography school and I’m trying to fine tune my note taking skills,/r/GoodNotes/comments/ksradc/became_a_fan_of_cornell_notes_in_nursing_school/giig5ct/,
241,giimjp4,t3_ksradc,Love your handwriting!,/r/GoodNotes/comments/ksradc/became_a_fan_of_cornell_notes_in_nursing_school/giimjp4/,athenajeunnessemae
242,gik89of,t3_ksradc,You have a video on how to take Cornell notes on your channel don’t you?,/r/GoodNotes/comments/ksradc/became_a_fan_of_cornell_notes_in_nursing_school/gik89of/,IcyEbonyRo5e
243,giyto5i,t3_ksradc,omg this is so aesthetic! if you were to print this out how would you change the page/color,/r/GoodNotes/comments/ksradc/became_a_fan_of_cornell_notes_in_nursing_school/giyto5i/,suzoer
244,gq61n74,t3_ksradc,"If you want to know why you should use cornell method, i wrote an article about it after using cornell for a year now. 

https://anqdnsh.wordpress.com/2021/03/02/cornell-note-taking-method/",/r/GoodNotes/comments/ksradc/became_a_fan_of_cornell_notes_in_nursing_school/gq61n74/,anqdnsh
