,comment_id,comment_parent_id,comment_body,comment_permalink,comment_author
245,gihv5ht,t1_gihph6o,I found them on her website [here](https://www.janicestudies.com/templates)!,/r/GoodNotes/comments/ksradc/became_a_fan_of_cornell_notes_in_nursing_school/gihv5ht/,averageidol
246,gihy7pn,t1_gihph6o,"This one is a notebook I created, but I have older free versions that you can find in the link posted by averageidol! 😊",/r/GoodNotes/comments/ksradc/became_a_fan_of_cornell_notes_in_nursing_school/gihy7pn/,Janicestudies
247,giib3ki,t1_gii7dle,Thank you! 😃,/r/GoodNotes/comments/ksradc/became_a_fan_of_cornell_notes_in_nursing_school/giib3ki/,Janicestudies
248,giimm00,t1_gii7dle,Omg. I just realized too when i read your message!,/r/GoodNotes/comments/ksradc/became_a_fan_of_cornell_notes_in_nursing_school/giimm00/,athenajeunnessemae
249,gihyg0w,t1_gihtwsn,I use ball pen only and this one was done with 0.6 mm white. A decently thick pen = neater writing!,/r/GoodNotes/comments/ksradc/became_a_fan_of_cornell_notes_in_nursing_school/gihyg0w/,Janicestudies
250,gihyjvg,t1_gihq6we,It’s much better than the outline method. I do a modified one with no summary but I just like the left column for its prompts and I can hide the notes in the right column with my hand to do active recall,/r/GoodNotes/comments/ksradc/became_a_fan_of_cornell_notes_in_nursing_school/gihyjvg/,Janicestudies
251,giib5cq,t1_gii93hq,Thank you! I usually do quick cursive though haha  😃,/r/GoodNotes/comments/ksradc/became_a_fan_of_cornell_notes_in_nursing_school/giib5cq/,Janicestudies
252,gihxpjg,t1_gihv5ht,thank you!!!☺️☺️,/r/GoodNotes/comments/ksradc/became_a_fan_of_cornell_notes_in_nursing_school/gihxpjg/,zoat99
253,gikh467,t1_gihy7pn,"Omg thank you so much for sharing the templates, I've been looking for a dotted cornell for a while and this one is perfect!",/r/GoodNotes/comments/ksradc/became_a_fan_of_cornell_notes_in_nursing_school/gikh467/,Elegant-Coffee-9480
254,h1hwu9m,t1_gihy7pn,"Hello, I’m late to this :-( Is there any where else I can download those versions?",/r/GoodNotes/comments/ksradc/became_a_fan_of_cornell_notes_in_nursing_school/h1hwu9m/,saltedeggcrab
255,gdid9to,t3_k0gqj2,This is so helpful! So many shades! Thank you!!,/r/GoodNotes/comments/k0gqj2/color_code_hex_numbers/gdid9to/,loveknitting37
256,gdkk7er,t3_k0gqj2,You for the win!!!!,/r/GoodNotes/comments/k0gqj2/color_code_hex_numbers/gdkk7er/,Imaginary-Tomorrow31
257,gdkwg56,t3_k0gqj2,I used to work for T-Mobile and still have their magenta code memorized. E20074.,/r/GoodNotes/comments/k0gqj2/color_code_hex_numbers/gdkwg56/,funky_grandma
258,gdlam4e,t3_k0gqj2,I’ve been dreaming of having a chart like this for my highlighting. Thank you!!!,/r/GoodNotes/comments/k0gqj2/color_code_hex_numbers/gdlam4e/,gresford
259,gdivc9v,t3_k0gqj2,Awh hell yeah,/r/GoodNotes/comments/k0gqj2/color_code_hex_numbers/gdivc9v/,miniaturegiraffe
260,gdjdfh0,t3_k0gqj2,Very cool! Thanks,/r/GoodNotes/comments/k0gqj2/color_code_hex_numbers/gdjdfh0/,Xerceos
261,gdjh5y2,t3_k0gqj2,Very helpful! Now I don't have to search on Google everytime I need an HEX code!,/r/GoodNotes/comments/k0gqj2/color_code_hex_numbers/gdjh5y2/,touch26
262,gdjxjtk,t3_k0gqj2,As a programmer this is so helpful! Thank you,/r/GoodNotes/comments/k0gqj2/color_code_hex_numbers/gdjxjtk/,ShinyEmeraldGames
263,gdk1zzd,t3_k0gqj2,"Great for reference, thank you!",/r/GoodNotes/comments/k0gqj2/color_code_hex_numbers/gdk1zzd/,okiegirl22
264,gdsd7x2,t3_k0gqj2,dim gray is nice nice nice,/r/GoodNotes/comments/k0gqj2/color_code_hex_numbers/gdsd7x2/,Trakido
265,ghktclq,t3_k0gqj2,Thank you!!,/r/GoodNotes/comments/k0gqj2/color_code_hex_numbers/ghktclq/,LifeWithValerieRose
266,hgw6gj7,t3_k0gqj2,Very cool just no clue how to use it lol.,/r/GoodNotes/comments/k0gqj2/color_code_hex_numbers/hgw6gj7/,Guzmanv_17
267,hw5xbzc,t3_k0gqj2,"Does anybody know which color GoodNotes uses for their ""Yellow"" paper? I tried beige but it seems slightly off.",/r/GoodNotes/comments/k0gqj2/color_code_hex_numbers/hw5xbzc/,RockStarUSMC
268,hhsjj1i,t1_hgw6gj7,You can use the hex codes in Windows and other programs like Office etc. to achieve the desired colors.,/r/GoodNotes/comments/k0gqj2/color_code_hex_numbers/hhsjj1i/,PhotographyFox_68
269,i872j2q,t1_hw5xbzc,You can probably take a screen shot and use the color dropper (according to my ipad the hex is F7F6E9),/r/GoodNotes/comments/k0gqj2/color_code_hex_numbers/i872j2q/,common_fairy
270,i87yvth,t1_i872j2q,Oh duh! Thank you lol,/r/GoodNotes/comments/k0gqj2/color_code_hex_numbers/i87yvth/,RockStarUSMC
