,comment_id,comment_parent_id,comment_body,comment_permalink,comment_author
0,hj14q1t,t3_ql7tlu,[deleted],/r/GoodNotes/comments/ql7tlu/hey_guys_just_wanted_to_announce_today_is_the_end/hj14q1t/,
1,hj15rln,t3_ql7tlu,I’m very mad this morning. I wish I liked the way my hand writing looked in good notes. This is going to be a rough adjustment.,/r/GoodNotes/comments/ql7tlu/hey_guys_just_wanted_to_announce_today_is_the_end/hj15rln/,peachyyarngoddess
2,hj1hi0t,t3_ql7tlu,"Wooooow that is bullshit. I primarily use notability because I like the organization system better, but this might push me off. I sincerely hate how subscription models have taken over the app market. This is a super shitty move by them and a slap in the face to people who have purchased their product.",/r/GoodNotes/comments/ql7tlu/hey_guys_just_wanted_to_announce_today_is_the_end/hj1hi0t/,Sometimesasshole
3,hj2fvoy,t3_ql7tlu,I doubt GoodNotes will do anything like this anytime soon (hopefully never) because they just watched Notability self-destruct their own community.,/r/GoodNotes/comments/ql7tlu/hey_guys_just_wanted_to_announce_today_is_the_end/hj2fvoy/,killerkooki3
4,hj330z2,t3_ql7tlu,"Notability is going against Apple ToS by locking features people already paid for behind a subscription. 

You can send a report here: https://reportaproblem.apple.com/store/360593530/select/fraudulent

Copy/Paste if you want: 

As of the new update to Notability (version 11.0), the developer has stated those who purchased the app before it was free will only have the functionality they paid for, for the next year, and will then be downgraded to the free version. This is against App Store guidelines section 3.1.2(a) which states that an app switching to a subscription model cannot remove features for those who have previously purchased the app.",/r/GoodNotes/comments/ql7tlu/hey_guys_just_wanted_to_announce_today_is_the_end/hj330z2/,fj-3
5,hj12m3o,t3_ql7tlu,"Until Goodnotes follows that ""freemium"" model and tanks itself.",/r/GoodNotes/comments/ql7tlu/hey_guys_just_wanted_to_announce_today_is_the_end/hj12m3o/,sugarxb0nes
6,hj17ly5,t3_ql7tlu,What happened?,/r/GoodNotes/comments/ql7tlu/hey_guys_just_wanted_to_announce_today_is_the_end/hj17ly5/,FancyPantsDolphin
7,hj2z76g,t3_ql7tlu,Is it worth it to switch over to Goodnotes?,/r/GoodNotes/comments/ql7tlu/hey_guys_just_wanted_to_announce_today_is_the_end/hj2z76g/,eeksclare
8,hj6i9jh,t3_ql7tlu,"Hi Goodnotes, bye bye Notability. And hi Goodnotes friends. 

Lol...",/r/GoodNotes/comments/ql7tlu/hey_guys_just_wanted_to_announce_today_is_the_end/hj6i9jh/,ElmagarNew
9,i9fv2k3,t3_ql7tlu,As long as GoodNotes doesn’t adopt the horrible subscription pricing model we’ll be bff’s for life 💯,/r/GoodNotes/comments/ql7tlu/hey_guys_just_wanted_to_announce_today_is_the_end/i9fv2k3/,WraithTron8
10,hj1vsi8,t3_ql7tlu,Lol just watch goodnotes do the samething,/r/GoodNotes/comments/ql7tlu/hey_guys_just_wanted_to_announce_today_is_the_end/hj1vsi8/,NatureAfraid4253
11,hj1o5uz,t3_ql7tlu,"Try colanote or apple notes Both are free!!
Infact cola notes is really good",/r/GoodNotes/comments/ql7tlu/hey_guys_just_wanted_to_announce_today_is_the_end/hj1o5uz/,Sidprad
12,if1d8w0,t3_ql7tlu,"If GoodNotes ever comes out with audio recording, Notability will never sell another copy.",/r/GoodNotes/comments/ql7tlu/hey_guys_just_wanted_to_announce_today_is_the_end/if1d8w0/,EyeGroundbreaking230
13,hj18jcf,t3_ql7tlu,"I like ColorNote myself, but I haven't tried the others tho.",/r/GoodNotes/comments/ql7tlu/hey_guys_just_wanted_to_announce_today_is_the_end/hj18jcf/,Soulkept
14,hj4a4pg,t3_ql7tlu,YAY kill notability goodnotes FTW!,/r/GoodNotes/comments/ql7tlu/hey_guys_just_wanted_to_announce_today_is_the_end/hj4a4pg/,hariztek
15,hja5z8g,t3_ql7tlu,*Insert I don’t want to play with you anymore meme here*,/r/GoodNotes/comments/ql7tlu/hey_guys_just_wanted_to_announce_today_is_the_end/hja5z8g/,Geeky_Introvert
16,hl8zn5j,t3_ql7tlu,Is there an easy way to port your Notability notes over to Goodnotes? I have SO MANY NOTES saved in Notability. :(,/r/GoodNotes/comments/ql7tlu/hey_guys_just_wanted_to_announce_today_is_the_end/hl8zn5j/,
17,i0zogxb,t3_ql7tlu,"I use notability for the ability to have graph paper. I use it to map dungeons in vintage games. I can draw a line and it snaps to the grid and straightens out my wiggly drawing of the line. 

Does goodnotes do this?",/r/GoodNotes/comments/ql7tlu/hey_guys_just_wanted_to_announce_today_is_the_end/i0zogxb/,ElSuperCactus
18,ioc1ei0,t3_ql7tlu,"I'd love to know if Goodnotes OR notability OR another app can do what I'm looking for..These are the note taking styles I want to accomplish on my iPad:

1. mindmapping/brain dumping style with the space available to keep growing as my thoughts/map grows
2. making summary notes from the physical text books I read
3. course pdf workbooks which already come with blank editable text boxes that I fill in with handwriting instead of typing
4. annotating pdf lecture notes, highlighting etc
5. When doing my research from reading physical books, can I take a photo of the page of value, highlight the key paragraph that was useful on the note taking app, and then make notes regarding this key paragraph in the app? Not necessarily 'annotating' that page beside the margins but using that paragraph as a springboard for idea generation and writing 'beside' the paragraph?  

6.   
\*\*Now the other key feature I want is if the app has a button that can **convert my WHOLE document of notes** into text which I can then easily export out as pdf or another editable document type so that I can refine my ideas with a keyboard on my computer subsequently (Eg I'm writing a book but the beginning ideas and development are all done by 'hand' and later quickly expanded upon by typing)I think that's it for now but would greatly appreciate learning if the above is possible. Thanks!",/r/GoodNotes/comments/ql7tlu/hey_guys_just_wanted_to_announce_today_is_the_end/ioc1ei0/,norestforthewicked99
19,isg1tyg,t3_ql7tlu,(Me has just silently downloaded Noteshelf),/r/GoodNotes/comments/ql7tlu/hey_guys_just_wanted_to_announce_today_is_the_end/isg1tyg/,Jackson_192
20,ixgthhz,t3_ql7tlu,*Apple note user watching the debate,/r/GoodNotes/comments/ql7tlu/hey_guys_just_wanted_to_announce_today_is_the_end/ixgthhz/,Over-Conversation908
21,hj1n1kk,t1_hj14q1t,I honestly think it’s inevitable that Goodnotes remains a purchase. I hope they stay the way they are but I doubt it.,/r/GoodNotes/comments/ql7tlu/hey_guys_just_wanted_to_announce_today_is_the_end/hj1n1kk/,DyRight
22,hj2ru0i,t1_hj15rln,Definitely play around with the pen size. I had the same issue until someone told me to edit the thickness until I got a good size. It really can change depending on how zoomed in you are when you write.,/r/GoodNotes/comments/ql7tlu/hey_guys_just_wanted_to_announce_today_is_the_end/hj2ru0i/,alexquacksalot
23,hj2mj3o,t1_hj2fvoy,"After watching Notability basically implode, I hope that the GN team is making other plans.",/r/GoodNotes/comments/ql7tlu/hey_guys_just_wanted_to_announce_today_is_the_end/hj2mj3o/,Synaptic_Jack
24,hj45cga,t1_hj2fvoy,Things GoodNotes will do my be releasing the GoodNote 6 or GoodNote 365. But it's totally fair.,/r/GoodNotes/comments/ql7tlu/hey_guys_just_wanted_to_announce_today_is_the_end/hj45cga/,alex-reddit-account
25,hj7ndpv,t1_hj2fvoy,Or they’re more likely to do it knowing users have no other apps to go to.,/r/GoodNotes/comments/ql7tlu/hey_guys_just_wanted_to_announce_today_is_the_end/hj7ndpv/,jccool5000
26,hj432aw,t1_hj330z2,"Tip: if your on reddits mobile app, open this post on chrome and scroll to find this comment so you can copy the text !",/r/GoodNotes/comments/ql7tlu/hey_guys_just_wanted_to_announce_today_is_the_end/hj432aw/,TTwoBodyProblem
27,hj5i314,t1_hj330z2,Apple is a bunch of money grubbing scumbags and doesn’t care; I’ve already sent reports on other apps that did this and nothing happened.  The only way to solve the problem is the Sue Apple and the dev of the app.,/r/GoodNotes/comments/ql7tlu/hey_guys_just_wanted_to_announce_today_is_the_end/hj5i314/,Thalinor
28,hj14d3g,t1_hj12m3o,[deleted],/r/GoodNotes/comments/ql7tlu/hey_guys_just_wanted_to_announce_today_is_the_end/hj14d3g/,
29,hj183si,t1_hj17ly5,[Notability switched to requiring a subscription](https://www.macrumors.com/2021/11/02/notability-users-frustrated-subscription-model/),/r/GoodNotes/comments/ql7tlu/hey_guys_just_wanted_to_announce_today_is_the_end/hj183si/,MrDominus7
30,hj3ak5j,t1_hj2z76g,definitely,/r/GoodNotes/comments/ql7tlu/hey_guys_just_wanted_to_announce_today_is_the_end/hj3ak5j/,nwe2rw
31,hj4f2kw,t1_hj1vsi8,"If this has no consequences from Apple’s side, more apps will certainly follow.",/r/GoodNotes/comments/ql7tlu/hey_guys_just_wanted_to_announce_today_is_the_end/hj4f2kw/,AmateurSysAdmin
32,hj1ojpw,t1_hj1o5uz,i was using it earlier in class and i like it overall but i wish i knew it automatically plays the lecture when you finish recording. it blasted in class earlier and everybody looked at me like “what was that” 😭,/r/GoodNotes/comments/ql7tlu/hey_guys_just_wanted_to_announce_today_is_the_end/hj1ojpw/,thebarbsdiary
33,itrndyj,t1_hj1o5uz,I liked collanote but it drained my battery a ton (100% to like 10 in an hour) despite  the fact that I use the newest ipad air😅,/r/GoodNotes/comments/ql7tlu/hey_guys_just_wanted_to_announce_today_is_the_end/itrndyj/,htdfvbhgf
34,hniamop,t1_hl8zn5j,mafe pdf trasnfer pdf to goodnote.,/r/GoodNotes/comments/ql7tlu/hey_guys_just_wanted_to_announce_today_is_the_end/hniamop/,ClinicalAnalysis
35,itrnm8f,t1_i0zogxb,"Yes, just that you only get 3 notebooks for free",/r/GoodNotes/comments/ql7tlu/hey_guys_just_wanted_to_announce_today_is_the_end/itrnm8f/,htdfvbhgf
36,hj1wf4a,t1_hj1n1kk,[deleted],/r/GoodNotes/comments/ql7tlu/hey_guys_just_wanted_to_announce_today_is_the_end/hj1wf4a/,
37,hj2rzux,t1_hj2ru0i,What is yours set to?,/r/GoodNotes/comments/ql7tlu/hey_guys_just_wanted_to_announce_today_is_the_end/hj2rzux/,peachyyarngoddess
38,hj4a7dk,t1_hj14d3g,ill move to apple notes lol,/r/GoodNotes/comments/ql7tlu/hey_guys_just_wanted_to_announce_today_is_the_end/hj4a7dk/,hariztek
39,hj21cvn,t1_hj183si,"If it was just switched to subscription and you kept what you already paid for, that probably would have been fine for the vast majority of users. 

Instead they chose to make a bunch of key features that people paid for in the past like cloud backup a premium feature now and your prior purchase now expires November 2022 for everyone.",/r/GoodNotes/comments/ql7tlu/hey_guys_just_wanted_to_announce_today_is_the_end/hj21cvn/,JaymesRS
40,hj3s5ao,t1_hj3ak5j,Even with the change in the grandfathering scheme for notability?,/r/GoodNotes/comments/ql7tlu/hey_guys_just_wanted_to_announce_today_is_the_end/hj3s5ao/,eeksclare
41,hj2lwtk,t1_hj1wf4a,"As a person with diagnosed ADHD, Due has been an absolute **Godsend** for keeping me on track with certain tasks.",/r/GoodNotes/comments/ql7tlu/hey_guys_just_wanted_to_announce_today_is_the_end/hj2lwtk/,Synaptic_Jack
42,hjnrzat,t1_hj1wf4a,"If you pay for the one year subscription after buying the app, do you keep the features that came out during that period after the subscription ends?",/r/GoodNotes/comments/ql7tlu/hey_guys_just_wanted_to_announce_today_is_the_end/hjnrzat/,DecoySnailProducer
43,hj2zkhq,t1_hj2rzux,"Just chiming in, irl I prefer super fine tip and brush pens. But in GoodNotes I usually switch between the medium and the large ball point depending on what I’m writing. 

I also downloaded a lot of free notebooks from random places until I found a set up that worked for me.",/r/GoodNotes/comments/ql7tlu/hey_guys_just_wanted_to_announce_today_is_the_end/hj2zkhq/,woahh_its_alle
44,hj4tr43,t1_hj4a7dk,"Same, begrudgingly lol",/r/GoodNotes/comments/ql7tlu/hey_guys_just_wanted_to_announce_today_is_the_end/hj4tr43/,MikaelDez
45,ifszedq,t1_hj3s5ao,Yes.  Templates are improved.  The only annoying thing is the lack of infinite pages on scroll.  So every page you have to add another one.,/r/GoodNotes/comments/ql7tlu/hey_guys_just_wanted_to_announce_today_is_the_end/ifszedq/,ScoopJr
46,i9fv7bt,t1_hj2lwtk,"I’ve really tried going back the the native Reminders, but Due always brings me back… I really need to break it off tho, I HATE the subscription pricing model for anything except streaming services.",/r/GoodNotes/comments/ql7tlu/hey_guys_just_wanted_to_announce_today_is_the_end/i9fv7bt/,WraithTron8
47,hj4fs6w,t1_hj2lwtk,Hey there what does the annual upgrade include?,/r/GoodNotes/comments/ql7tlu/hey_guys_just_wanted_to_announce_today_is_the_end/hj4fs6w/,willnessNo2365
48,hk20aud,t1_hjnrzat,[deleted],/r/GoodNotes/comments/ql7tlu/hey_guys_just_wanted_to_announce_today_is_the_end/hk20aud/,
49,hj7e097,t1_hj2zkhq,"I've been having issues finding free notebooks, I've only seen paid ones so far. Where did you download them from?",/r/GoodNotes/comments/ql7tlu/hey_guys_just_wanted_to_announce_today_is_the_end/hj7e097/,starriex
50,ih08b8o,t1_ifszedq,"Not a big deal… pull to add the page, move on with life.",/r/GoodNotes/comments/ql7tlu/hey_guys_just_wanted_to_announce_today_is_the_end/ih08b8o/,EyeGroundbreaking230
51,hk2lku7,t1_hk20aud,Thanks,/r/GoodNotes/comments/ql7tlu/hey_guys_just_wanted_to_announce_today_is_the_end/hk2lku7/,DecoySnailProducer
52,hj7g7e2,t1_hj7e097,I actually found most of mine from people who had paid content and freebies. I had to sign up for a lot handful of emailing lists and I think one put me on a waitlist. I want to say some were on Instagram and some I found from googling.,/r/GoodNotes/comments/ql7tlu/hey_guys_just_wanted_to_announce_today_is_the_end/hj7g7e2/,woahh_its_alle
53,g9nztma,t3_jg3xzz,"lemon sunshine: FFDC74
beach at sunset: FBAC87
watermelon spring: FF8C87
cotton candy cheeks: F3A6C8
moonlit lily: DEACF9
clear sky sea: AEB5FF
mountain breeze waves: 95C8F3
toes in the lagoon: 81E3E1
jungle getaway: 7DE198
golf club special: B3E561",/r/GoodNotes/comments/jg3xzz/hex_set_of_bright_highlighters_enjoy_hex_codes/g9nztma/,cleothefairy
54,g9q8eq3,t3_jg3xzz,"These names are so creative, when I shared my colors a bit back I tried so hard to think of cool names. I stared at the colors for maybe 15 minutes before I gave up and just shared 🤣🤣",/r/GoodNotes/comments/jg3xzz/hex_set_of_bright_highlighters_enjoy_hex_codes/g9q8eq3/,dokina
55,g9yafug,t3_jg3xzz,Thx so much!  Just got my GoodNotes... so I appreciate getting to add these to my presets!  Love it!,/r/GoodNotes/comments/jg3xzz/hex_set_of_bright_highlighters_enjoy_hex_codes/g9yafug/,BelizeDenize
56,g9o9eag,t3_jg3xzz,You are a lifesaver!!!,/r/GoodNotes/comments/jg3xzz/hex_set_of_bright_highlighters_enjoy_hex_codes/g9o9eag/,collegegeek99
57,g9p6fh0,t3_jg3xzz,I love the names of these colours!,/r/GoodNotes/comments/jg3xzz/hex_set_of_bright_highlighters_enjoy_hex_codes/g9p6fh0/,
58,hgw5ke5,t3_jg3xzz,I just downloaded GoodNotes!! I’m so excited and haven’t a clue what I’m doing lol.,/r/GoodNotes/comments/jg3xzz/hex_set_of_bright_highlighters_enjoy_hex_codes/hgw5ke5/,Guzmanv_17
59,g9pnpv0,t3_jg3xzz,They are so pretty!! Thank you!,/r/GoodNotes/comments/jg3xzz/hex_set_of_bright_highlighters_enjoy_hex_codes/g9pnpv0/,corgobsessions
60,gasqqe4,t3_jg3xzz,"Just came across these now and i love them! Thanks and well done, they are gorgeous!",/r/GoodNotes/comments/jg3xzz/hex_set_of_bright_highlighters_enjoy_hex_codes/gasqqe4/,_--_---_-_
61,i1pg7d6,t3_jg3xzz,Bless up,/r/GoodNotes/comments/jg3xzz/hex_set_of_bright_highlighters_enjoy_hex_codes/i1pg7d6/,maryjanedahmer
62,g9olont,t1_g9nztma,"Thanks! 
And for any one wanting just the codes (in order):

FFDC74
FBAC87
FF8C87
F3A6C8
DEACF9
AEB5FF
95C8F3
81E3E1
7DE198
B3E561",/r/GoodNotes/comments/jg3xzz/hex_set_of_bright_highlighters_enjoy_hex_codes/g9olont/,
63,g9r67en,t1_g9nztma,Thank you so much. I love this!,/r/GoodNotes/comments/jg3xzz/hex_set_of_bright_highlighters_enjoy_hex_codes/g9r67en/,wavvy_fiji
64,g9qhysh,t1_g9q8eq3,"Oh, thanks, it definitely took me a while but I usually just thought of what that particular shade represents for me and it worked! 😄",/r/GoodNotes/comments/jg3xzz/hex_set_of_bright_highlighters_enjoy_hex_codes/g9qhysh/,cleothefairy
65,g9yphb7,t1_g9yafug,"You’re very welcome, enjoy and welcome to the club! 🥰",/r/GoodNotes/comments/jg3xzz/hex_set_of_bright_highlighters_enjoy_hex_codes/g9yphb7/,cleothefairy
66,g9oelcr,t1_g9o9eag,Glad you like it!,/r/GoodNotes/comments/jg3xzz/hex_set_of_bright_highlighters_enjoy_hex_codes/g9oelcr/,cleothefairy
67,g9pa657,t1_g9p6fh0,thanks! 🥰,/r/GoodNotes/comments/jg3xzz/hex_set_of_bright_highlighters_enjoy_hex_codes/g9pa657/,cleothefairy
68,g9qhm52,t1_g9pnpv0,"You’re welcome, I’m glad you like it!",/r/GoodNotes/comments/jg3xzz/hex_set_of_bright_highlighters_enjoy_hex_codes/g9qhm52/,cleothefairy
69,gaujmcx,t1_gasqqe4,You’re very welcome and thank you! 🥰,/r/GoodNotes/comments/jg3xzz/hex_set_of_bright_highlighters_enjoy_hex_codes/gaujmcx/,cleothefairy
70,gnuq84b,t3_lmclld,I am always amazed by how intelligent this tool is!,/r/GoodNotes/comments/lmclld/where_would_i_be_without_the_lasso_tool/gnuq84b/,theguyfrom340
71,gnv9sth,t3_lmclld,"Screenshot option in lasso Is my fav, really helped to make anki flashcards easily",/r/GoodNotes/comments/lmclld/where_would_i_be_without_the_lasso_tool/gnv9sth/,michaelscot1548
72,gnwrucz,t3_lmclld,"It’s honestly so useful, but I wish GoodNotes also had a ‘highlight select’ tool alongside the lasso tool. Cos when I write I sometimes can’t select a sentence without the lasso also selecting letters from the sentence above it (like g’s and y’s because the letter has a long ‘tail’)",/r/GoodNotes/comments/lmclld/where_would_i_be_without_the_lasso_tool/gnwrucz/,fj-3
73,gnwnw6s,t3_lmclld,My favourite tool!! Love it so much!! It’s such an ingenious creation,/r/GoodNotes/comments/lmclld/where_would_i_be_without_the_lasso_tool/gnwnw6s/,mercydesu
74,gny82xi,t3_lmclld,Quality post,/r/GoodNotes/comments/lmclld/where_would_i_be_without_the_lasso_tool/gny82xi/,DirtyHirdy
75,h547lro,t3_lmclld,This is how I feel about the IPad itself.,/r/GoodNotes/comments/lmclld/where_would_i_be_without_the_lasso_tool/h547lro/,Puzzleheaded-Gap7302
76,i1pg638,t3_lmclld,I agree it’s the best,/r/GoodNotes/comments/lmclld/where_would_i_be_without_the_lasso_tool/i1pg638/,maryjanedahmer
77,gnv61oz,t1_gnuq84b,same!!! i use it for everything haha :) just wish goodnotes would allow us to move things (like highlighters and text) forward and backward between layers one day!,/r/GoodNotes/comments/lmclld/where_would_i_be_without_the_lasso_tool/gnv61oz/,fishsoz
78,hy330ru,t1_gnv9sth,I have a question...have you figured out how to take quick screenshot using Lasso tool. Instead of circling - press&hold - take screenshot - share button- copy,/r/GoodNotes/comments/lmclld/where_would_i_be_without_the_lasso_tool/hy330ru/,chillyjulius
79,gnx2zb5,t1_gnv61oz,"Omg yes, being able to shift up or down in the later stack would be so nice",/r/GoodNotes/comments/lmclld/where_would_i_be_without_the_lasso_tool/gnx2zb5/,Lunarius0
80,gpy55ey,t3_lz0rjk,"Yeah, there is room for improvement :D",/r/GoodNotes/comments/lz0rjk/uhhhthat_shape_detection/gpy55ey/,Spaceistheplace2
81,gpyvb4s,t3_lz0rjk,Why am I laughing so hard at this lmaooo,/r/GoodNotes/comments/lz0rjk/uhhhthat_shape_detection/gpyvb4s/,chub-bear
82,gpz3i68,t3_lz0rjk,"Oh, so it's not just me that draws circles with corners? Gdgd. Glad I'm not alone.",/r/GoodNotes/comments/lz0rjk/uhhhthat_shape_detection/gpz3i68/,therealamyjay
83,gpzkgf3,t3_lz0rjk,thank you op for making me laugh out loud so early in the day,/r/GoodNotes/comments/lz0rjk/uhhhthat_shape_detection/gpzkgf3/,luxentine
84,gpzl3pp,t3_lz0rjk,Damn try drawing a root symbol (square root) it frustrates me every time,/r/GoodNotes/comments/lz0rjk/uhhhthat_shape_detection/gpzl3pp/,newk_03
85,gpzyd8i,t3_lz0rjk,i laughed so hard lmaooo but a circle = square right?? bc 360°,/r/GoodNotes/comments/lz0rjk/uhhhthat_shape_detection/gpzyd8i/,rachelmganza
86,gq1zam9,t3_lz0rjk,Omg I thought I was The only one who this happens to. I sent them this as well on their support email,/r/GoodNotes/comments/lz0rjk/uhhhthat_shape_detection/gq1zam9/,
87,gq2da45,t3_lz0rjk,This is way funnier than it shouldve been haha,/r/GoodNotes/comments/lz0rjk/uhhhthat_shape_detection/gq2da45/,KoreanChemistry
88,gq0hz11,t3_lz0rjk,Almost had it,/r/GoodNotes/comments/lz0rjk/uhhhthat_shape_detection/gq0hz11/,RL2397
89,gsym5nz,t3_lz0rjk,LMAOO I love this,/r/GoodNotes/comments/lz0rjk/uhhhthat_shape_detection/gsym5nz/,
90,i1pg9og,t3_lz0rjk,Yeah it doesn’t work 😂,/r/GoodNotes/comments/lz0rjk/uhhhthat_shape_detection/i1pg9og/,maryjanedahmer
91,ivyt8kx,t3_lz0rjk,Soooo… how did you draw that circle that appears to the left?,/r/GoodNotes/comments/lz0rjk/uhhhthat_shape_detection/ivyt8kx/,EyeGroundbreaking230
92,gpy6eof,t1_gpy55ey,Definitely an understatement haha,/r/GoodNotes/comments/lz0rjk/uhhhthat_shape_detection/gpy6eof/,SkatePA
93,gpz02ck,t1_gpyvb4s,Hahahah,/r/GoodNotes/comments/lz0rjk/uhhhthat_shape_detection/gpz02ck/,SquadLoser
94,gpzkko8,t1_gpzkgf3,"No problem, have a great rest of the day :)",/r/GoodNotes/comments/lz0rjk/uhhhthat_shape_detection/gpzkko8/,SquadLoser
95,gq2j12p,t1_gpzl3pp,It actually works so well for me. Notability doesn't even do it :(,/r/GoodNotes/comments/lz0rjk/uhhhthat_shape_detection/gq2j12p/,ashtothesheep
96,gqlrp3l,t1_gq2da45,LMAO RIGHT,/r/GoodNotes/comments/lz0rjk/uhhhthat_shape_detection/gqlrp3l/,Tae_Ka12
97,gpy6ni0,t1_gpy6eof,Arrow shape detection would be awesome,/r/GoodNotes/comments/lz0rjk/uhhhthat_shape_detection/gpy6ni0/,Spaceistheplace2
98,gpy6slr,t1_gpy6ni0,Also an option to draw dotted lines!,/r/GoodNotes/comments/lz0rjk/uhhhthat_shape_detection/gpy6slr/,SkatePA
99,gpy7cq7,t1_gpy6slr,Oh yes i`ve thought about that too. Or password protection for some documents,/r/GoodNotes/comments/lz0rjk/uhhhthat_shape_detection/gpy7cq7/,Spaceistheplace2
100,gpz3y11,t1_gpy7cq7,"Yeah, it would be awesome if we could get dotted lines and the ability to add an arrowhead to the lines without having to draw it each time.",/r/GoodNotes/comments/lz0rjk/uhhhthat_shape_detection/gpz3y11/,therealamyjay
101,hix5u48,t3_qkkp95,If GoodNotes will ever do this - I will start my own note taking app 😜,/r/GoodNotes/comments/qkkp95/after_notabilitys_anouncement/hix5u48/,notsure-pink
102,hix9i3f,t3_qkkp95,What did notability announce?,/r/GoodNotes/comments/qkkp95/after_notabilitys_anouncement/hix9i3f/,yonosoymajo
103,hix41n4,t3_qkkp95,I am so furious!,/r/GoodNotes/comments/qkkp95/after_notabilitys_anouncement/hix41n4/,Why_A_Username1
104,hixke8e,t3_qkkp95,Have to subscribe for unlimited editing….excellent,/r/GoodNotes/comments/qkkp95/after_notabilitys_anouncement/hixke8e/,Medusas_Kiss
105,hiz27cm,t3_qkkp95,"I’ve seen many people on Twitter asking them if they’re going to switch to subscription based payment, but I’m pretty sure they will not, I mean, just imagine the number of people switching to Goodnotes, one time payment has become their USP now",/r/GoodNotes/comments/qkkp95/after_notabilitys_anouncement/hiz27cm/,hahsakhssinak
106,hiz2fyf,t3_qkkp95,"Goodnotes 5 is wayyyyyyyy ahead of notability 11, GN already has all those features

So please please please always remain the way you are GN in terms of payment, I heavily rely on you and paying for subscription is just too much for me

You’re an amazing app, thank you for existing",/r/GoodNotes/comments/qkkp95/after_notabilitys_anouncement/hiz2fyf/,hahsakhssinak
107,hiz0cz0,t3_qkkp95,"you don't know when GoodNotes'd switch to subscription model, too.",/r/GoodNotes/comments/qkkp95/after_notabilitys_anouncement/hiz0cz0/,jostyee
108,hiza62y,t3_qkkp95,If goodnotes ever does go subscription I’m screwed…,/r/GoodNotes/comments/qkkp95/after_notabilitys_anouncement/hiza62y/,chopin124
109,hj0mb0v,t3_qkkp95,"Fucken Notability. 

I'm gonna finish up the ""trial"" until next year and see if GoodNotes are gonna fuck students over as well. If they don't within the next year then GN it is!",/r/GoodNotes/comments/qkkp95/after_notabilitys_anouncement/hj0mb0v/,MundaneHumane
110,hj0w03s,t3_qkkp95,I was going to buy it some months ago but I decided for Apple Notes,/r/GoodNotes/comments/qkkp95/after_notabilitys_anouncement/hj0w03s/,nairazak
111,hj11iz5,t3_qkkp95,What happened?,/r/GoodNotes/comments/qkkp95/after_notabilitys_anouncement/hj11iz5/,WriterJumpy
112,hixbncz,t1_hix5u48,Eventually they will. But i still perfer goodnotes file system,/r/GoodNotes/comments/qkkp95/after_notabilitys_anouncement/hixbncz/,Public_Difficulty_35
113,hiymmo0,t1_hix5u48,"CollaNote ftw. Made by one of the people for the people, so I trust they won't ever do this.",/r/GoodNotes/comments/qkkp95/after_notabilitys_anouncement/hiymmo0/,NoDryHands
114,hixmds9,t1_hix9i3f,"They announced freemium model for all users.  
BUT they will remove most features next year for people who one-time bought Notability to force them to subscribe.

This is against Apple guidelines also. Filled a complain against them.",/r/GoodNotes/comments/qkkp95/after_notabilitys_anouncement/hixmds9/,crysis4000
115,hixfhw8,t1_hix9i3f,Notability will now be free with an optional paid subscription tier. So basically they went freemium.,/r/GoodNotes/comments/qkkp95/after_notabilitys_anouncement/hixfhw8/,23011447
116,hiz234h,t1_hiz0cz0,"No no they shouldn’t pleaseeee, they’ve always brought out new features saying- “and remember, it’s for free, always” (after the one time payment of course)",/r/GoodNotes/comments/qkkp95/after_notabilitys_anouncement/hiz234h/,hahsakhssinak
117,hiyoss3,t1_hixbncz,"Notes Plus has had Goodnotes' file system for years. I am not sure how their new app is, but the old one is no longer getting updates. I was using it from 2012 until 2020 on my iPad Air 1.",/r/GoodNotes/comments/qkkp95/after_notabilitys_anouncement/hiyoss3/,sinvis
